{
    "slug": "westfalia",
    "relevant-countries": [
        "de"
    ],
    "categories": [
        "commerce"
    ],
    "name": "HAJUS AG",
    "runs": [
        "Westfalia"
    ],
    "address": "Spinnereistraße 3\n01591 Riesa\nDeutschland",
    "phone": "+49 5151 8779812",
    "email": "info@westfalia.de",
    "web": "https://www.westfalia.de/",
    "sources": [
        "https://www.westfalia.de/datenschutz",
        "https://github.com/datenanfragen/data/pull/3870"
    ],
    "quality": "verified"
}
