{
    "slug": "moshbit",
    "relevant-countries": [
        "at"
    ],
    "categories": [
        "school"
    ],
    "name": "Moshbit GmbH",
    "runs": [
        "Studo"
    ],
    "address": "Joanneumring 3 \n8010 Graz\n√ñsterreich",
    "phone": "+43 664 8351081",
    "email": "datenschutz@moshbit.com",
    "web": "https://moshbit.com",
    "sources": [
        "https://moshbit.com/legalnotice.html",
        "https://studo.co/impressum",
        "https://github.com/datenanfragen/data/issues/206",
        "https://github.com/datenanfragen/data/pull/916"
    ],
    "suggested-transport-medium": "email",
    "quality": "verified"
}
