{
    "slug": "invoice-2go",
    "relevant-countries": [
        "all"
    ],
    "name": "Invoice2go, Inc.",
    "runs": [
        "Invoice2go"
    ],
    "address": "555 Bryant St. #263\nPalo Alto, CA 94301\nUSA",
    "email": "legal@invoice2go.com",
    "web": "https://invoice.2go.com",
    "sources": [
        "https://invoice.2go.com/privacy-policy/",
        "https://github.com/datenanfragen/data/pull/1607"
    ],
    "suggested-transport-medium": "email",
    "quality": "verified"
}
