{
    "slug": "ttt48",
    "relevant-countries": [
        "all"
    ],
    "categories": [
        "commerce",
        "health"
    ],
    "name": "TTT-Filmservice GmbH",
    "address": "Röntgentraße 4\n67133 Maxdorf\nDeutschland",
    "phone": "07131 - 3828 998",
    "fax": "07131-20392-29",
    "email": "shop@ttt48.de",
    "web": "https://www.ttt48.de",
    "sources": [
        "https://www.ttt48.de/datenschutz.html",
        "https://github.com/datenanfragen/data/pull/1544"
    ],
    "quality": "verified"
}
